hashtags:,#arquitectura,#viajes,#travel,#mochilerostv,#turismo,#yodescubriyucatan,#edificiosmayas,#mochilerosmx,#discovery,#amazing,#visityucatan,#photooftheday,#picoftheday,#mextagram
post_url,username,comment_id,comment_text
edificiosmayas,17850222037099572,https://www.instagram.com/p/BHfA9QdAom3/,@maggicamberos si igualmente pienso lo mismo :) @vicdady saludos! 👍
edificiosmayas,17850222007099572,https://www.instagram.com/p/BHfA9QdAom3/,"@lizcolome next to the hacienda are mayan ruins, is a very magical place :)"
lizcolome,17849492323099572,https://www.instagram.com/p/BHfA9QdAom3/,isn't this hacienda a museum?  and has ruins next door?
maggicamberos,17849114659099572,https://www.instagram.com/p/BHfA9QdAom3/,Si así es bella me imagino en su esplendor como era 😍
vicdady,17849104642099572,https://www.instagram.com/p/BHfA9QdAom3/,"👍 interesante lugar, la Hacienda, como la zona Arqueológica, te envió unas fotos que tomé, espero te guste, Saludos"
