hashtags:,#yucatán,#mérida,#arte,#museo,#galeria
post_url,username,comment_id,comment_text
ginn_amaya,18038653334359363,https://www.instagram.com/p/DMYs7jGP9O2/,"Wowww, me encanta ♥️"
ugomez_olivan,18131815471440201,https://www.instagram.com/p/DMYs7jGP9O2/,La casa gemela y Las Casas Gemelas
baroch_glez,17911515129174862,https://www.instagram.com/p/DMYs7jGP9O2/,"Casa gemela un lugar sin igual, muy recomendado"
sonia_glez08,17865784944356607,https://www.instagram.com/p/DMYs7jGP9O2/,Sus cursos son para toda la familia y también tiene restaurantes @bibani.cocina
