hashtags:,#Yucatán,#GoProMX,#GoPro,#igersyucatan,#mochilerosmx,#discovery,#igers,#Mexico,#edificiosmayas,#mochileros,#yodescubriyucatan,#YucatanVenPorTodo
post_url,username,comment_id,comment_text
kareen_aguilar23,17864970064058015,https://www.instagram.com/p/BK6JJbVgSND/,Yo fui a tomar fotos también allá! ☺️
kevopolanco,17842773109162185,https://www.instagram.com/p/BK6JJbVgSND/,Esta bueno para jugar gotcha
gogonzaexpeditions,17842755505162185,https://www.instagram.com/p/BK6JJbVgSND/,Dicen que ahí hay más narcos que fantasmas
misaelzozayaphotography,17842754608162185,https://www.instagram.com/p/BK6JJbVgSND/,Yo también!!! @edificiosmayas @abrahamojica
edificiosmayas,17842739857162185,https://www.instagram.com/p/BK6JJbVgSND/,De verdad? Me apunto! Saludos!
abrahamojica,17842738735162185,https://www.instagram.com/p/BK6JJbVgSND/,Tenemos que ir a acampar allá 😝
