hashtags:,#recetas,#aprobadoporelsoco
post_url,username,comment_id,comment_text
iyzvss,17936251850859535,https://www.instagram.com/p/DDSuaDHpzFU/,Cuida tu salud.
alejandroojeda012592,17905301163064664,https://www.instagram.com/p/DDSuaDHpzFU/,De hecho el c치lido de cl치sicos es el verde !
max.ojeda,17887345146118368,https://www.instagram.com/p/DDSuaDHpzFU/,"Mi querido Socotroco, yo hace tiempo que te sigo y me parecen muy buenos los videos que subes, por que tienes gracia y la haces de forma nata, pero no me pareci칩 que por un comentario de cr칤tica me haya bloqueado tu esposa. La verdad no me parece que se aproveche de tu fama para que se cuelgue. Tu si tienes gracia, pero ella no!!!."
max.ojeda,18263615860249900,https://www.instagram.com/p/DDSuaDHpzFU/,"Mi estimada Merci y mi estimado Socotroco, yo te segu칤a por que me parec칤an graciosos los videos que sub칤as con los comentarios de tu esposa en OFF, cuando dec칤a: ""HAY ALFONSO""... Pero ahorita que sube sus propios videos, la verdad no se me hace graciosa, al contrario asusta cuando abre sus ojos, hay personas que si la hacen y personas que no la hacen, no la quieran sacar monetizaci칩n con una gracia que no tienen. Saludos!."
_prissalazar,17958694286731712,https://www.instagram.com/p/DDSuaDHpzFU/,"Que rico se ve ese spaghetti, saludos soco 游삟游낕"
