hashtags:,#Kek칠n
post_url,username,comment_id,comment_text
laselvaplayadelcarmen,18446579158021715,https://www.instagram.com/p/C9SxqWbpWQs/,Que onda soco andas por las europeas ... Purooo viajar chavo
jashersanchez,18238759453261063,https://www.instagram.com/p/C9SxqWbpWQs/,Ojal치 @alexis_minero2001 haga el reto de comer 1 pizza de pierna entera de @pizzaycorremid
jashersanchez,18023141069071741,https://www.instagram.com/p/C9SxqWbpWQs/,"Mi favorita de Pizza y Corre es la ""Jordan"" 游땘游땘游땘"
chikilinhot,17968988801759572,https://www.instagram.com/p/C9SxqWbpWQs/,No es de mi agrado se siente secaaaaaaaaaa sin demeritar que he pedido de otros ingredientes y est치 al tiro pero si la de pierna deja mucho que desear
chato_varon,17845068444257032,https://www.instagram.com/p/C9SxqWbpWQs/,La primera fue en la 50 sur su pap치 regresar ISO de usa y habrio la primera en la frontera 50 sur
joyc3diva,18043058413953782,https://www.instagram.com/p/C9SxqWbpWQs/,"@chato_varon la primera no fue ah칤, fue por el estadio Kukulk치n (la de la foto) esa es la primera sucursal y su hija hizo en la publicaci칩n en su facebook"
