https://www.instagram.com/p/DNFDZ4sJfM2/,hashtags:,#aprobadoporelsoco,#humor,#esposos
username,comment_id,text
yu._.gogi,18056279666372921,"Amo esta pareja, su alegria y su amorわ"
claudiaydavidthefestivecouple,18107662522554837,Wow!!! Te ves s煤per bien わ
jessicagvg,17921963031108653,Amo su sentido del humor!
altair_ramirez,18522908515041157,No mamen cre铆 que era un Pandarian jajajaja saludos
bea_cruz_26,18339921280165989,Alfonso  se te ve requetebi茅n わ mira tu quien dir铆a que Jap贸n le quedar铆a de lujo
mitzinrules,17944584519030830,La neta si se ve muy bien 
ellis.montes,18063104612184502,Qu茅 bueno que pudiste encontrar el yukata en tu talla. Todos que encontraba cuando estaba all铆 no me quedaban 
irelysnoratomacias,18086350555765926,Jajajajaja su clase de sumooooo
cafeboutique_oficial,17929065795094069,
king_of_the_bullies,18092074495727534,Sumooooooooo
lvronline,18036709883440713,"Disfrazado de trapeador neeee, todo fres贸n "
charro6300,18056420903529038,Wuaiiiiiii El guerrero drag贸n pap谩
johanagory,18332889046203150,Son adorables uds わわ
adyhipoblue,18014204723587925,
elizabethlorzah,18190037896319877,Muy guapet贸n se ve super genial
marcocjg,17958223325971394,Lo que pocos saben es que ese conjunto es talla M
king_of_the_bullies,18046538978305856,
sergio.l.gonzalez1,18064189460463089,El verdadero guerrero drag贸n. 
carlos_areyes07,18047572577280564,
