https://www.instagram.com/p/BWlIKEgAWCl/,hashtags:,#ibeliveicanfly,#TilaEnCDMX
username,comment_id,text
mariajesusbacab,17880906136075418,La mejor del mundo mundial
pedro_gomez_casanova,17889665263053295,Está vez ya no pude llegar a tu show a ver cuando regresas
alexyanezdigital,17877384646100907,Ya eres una estrella tu muy bien @tilasesto
alexa_hadad,17889829903035866,Me quede de ganas de mi foto..excelente
albahoil,17876969917115381,"Me quedé con ganas de oírte cantar ""deja ya la rutiiinaa y ponte a vacilaaaiar"" #TilaEnCDMX"
fabiac_,17848263025195454,Hola tila saludos linda tarde
larry_kgnonga_,17875925092126660,"Anoche te vimos espectacular , me quedé con las ganas de gritarte TE AMO TILA"
