hashtags:,#maestros,#heroessincapa
post_url,username,comment_id,comment_text
wenever_xp,18086167048467354,https://www.instagram.com/p/C-LiBhQhaIu/,Le aplaudo se lo reconozco enhorabuena dijo algo muy cierto todos los maestros odiamos clases en pandemia y ah칤 literalmente salieron los verdaderos estudiantes los que s칤 quer칤an aprender se conectaban los que siempre han sido barcos y transatl치nticos e interplanetarios jam치s salieron
mordadazarath,17859146190212625,https://www.instagram.com/p/C-LiBhQhaIu/,"Mi mam치 sin saber de tecnolog칤a aprendi칩 a hacer sus clases virtuales, revisar y aubir trabajos en l칤nea y ya estando a a침itos de jubilarse 游땘"
amelia10946,17977794050726500,https://www.instagram.com/p/C-LiBhQhaIu/,游땵游땵
nakaale3,18043413496913589,https://www.instagram.com/p/C-LiBhQhaIu/,"Dar clases virtuales es una tortura para maestros, cero vida. Solo quienes dimos clases virtuales sabemos la tortura que fue 游땩"
