hashtags:,#ElAventonConTila
post_url,username,comment_id,comment_text
lizbeth_gzzlara,18048723283245133,https://www.instagram.com/p/BLP7JbXgwy_/,游땵游땵游땵游땵
samreyes78,17843155063184103,https://www.instagram.com/p/BLP7JbXgwy_/,Pelos! Que fumaste Tila?
prexiosa291,17843120833184103,https://www.instagram.com/p/BLP7JbXgwy_/,X cierto mi marido es de izamal yucatan y tu as sido mi guia para estar mas cerca de sus palabrotas jajaja ahora ya los entiendo !!
prexiosa291,17843120431184103,https://www.instagram.com/p/BLP7JbXgwy_/,"Ke suerte tienen las k no se ba침an..jajaja chiste nete me,caes de pelos"
rosa.lopez250175,17843058280184103,https://www.instagram.com/p/BLP7JbXgwy_/,Tila que cosas encuentras quien como tu
cachonleon,17843026009184103,https://www.instagram.com/p/BLP7JbXgwy_/,Ola soy de c ordemex me gusta lo que ases Felicidades
leslie.corvinus,17843025349184103,https://www.instagram.com/p/BLP7JbXgwy_/,Maaa! Estas poca madre!! Me encant칩 la foto se ven muy geniales tus ojos como cuando est치s puje y puge paque salga tu miarda @tilasesto jajaja jajaja!!!!!
alejandra_kuyoc,17843023474184103,https://www.instagram.com/p/BLP7JbXgwy_/,Es enserio?? Wow te envidio perris 游游Dale un besote de mi parte
lucero_cuervo_,17843015044184103,https://www.instagram.com/p/BLP7JbXgwy_/,Guapos 游땡
karenvduran1,17843013964184103,https://www.instagram.com/p/BLP7JbXgwy_/,游땯
pirixon,17843004769184103,https://www.instagram.com/p/BLP7JbXgwy_/,Oscar recuerdo como te jodia melo colli en los escenarios y aquel dicho tuyo Te vooooyy a pegar cuidate mucho que bien mereces el lugar que hoy tienes
c662135pm,17843004670184103,https://www.instagram.com/p/BLP7JbXgwy_/,Nooooooo la chifleees que es caaantadaaaa tila
archaeusgoddess,17843004397184103,https://www.instagram.com/p/BLP7JbXgwy_/,"@tilasesto, 쯖칩mo puedo contactarme contigo para invitarte a una conferencia?"
maricriscampos,17843001472184103,https://www.instagram.com/p/BLP7JbXgwy_/,Que cosaaaaaaa m치s bellaaaaa jajajajaja tilaaaaaaaaaaa ll칠vame en la cajuela pa verlo 游때游때游때 jajajaja @tilasesto
