hashtags:,#2026,#humor,#comedia,#fblifestyle,#HappyNewYear
post_url,username,comment_id,comment_text
victorramayo,18072678161580064,https://www.instagram.com/p/DS8JCkXk0UY/,🤣🤣🤣
pedroantonioleo,18081272372270522,https://www.instagram.com/p/DS8JCkXk0UY/,Esto es mejor que las lonas🥵
suemynoemi,18433481161106712,https://www.instagram.com/p/DS8JCkXk0UY/,Por favor algún contacto para contratar show de tila
kmart_z97,17995941095883442,https://www.instagram.com/p/DS8JCkXk0UY/,Información para contratar show
