hashtags:,#PasitoPerron,#RaspandoChancleta,#BailandoPorUnSueño,#Zumba
post_url,username,comment_id,comment_text
psic_y_tanatologa_belgica,17882887666044490,https://www.instagram.com/p/BUzo_eeBkuV/,que suba el vídeo con el pasito perron
elychan842,17870865028105231,https://www.instagram.com/p/BUzo_eeBkuV/,K tila tiene cara como k se hecho una bomba muy yucateca jjjj
flower79santos,17867913160094644,https://www.instagram.com/p/BUzo_eeBkuV/,Te ves sepsi tila
rushito8169,17876107423067741,https://www.instagram.com/p/BUzo_eeBkuV/,Rienes muy buen ritmo en el cuerpower
asiruy,17877256702064628,https://www.instagram.com/p/BUzo_eeBkuV/,Pense que estabas aguantando las ganas de ir al.baño @tilasesto saludos desde chiapas
damian_chito,17858181025155853,https://www.instagram.com/p/BUzo_eeBkuV/,El de simi
