hashtags:,#swimmingpool,#natation,#water,#training,#healthy,#sport,#tgif,#lovesport,#nadadora,#natación,#strong,#friday,#swimmer
post_url,username,comment_id,comment_text
vickywolff,17848932175057763,https://www.instagram.com/p/7f_LYKqywr/,"@ugo.avila de 11 am a 3 pm :) según yo la hora libre es mas barata, yo pago las clases normales pero voy a esa hora jaja 🙊"
ugo.avila,17848932172057763,https://www.instagram.com/p/7f_LYKqywr/,Enserio? Sin costo extra? A que hora es?
vickywolff,17848932148057763,https://www.instagram.com/p/7f_LYKqywr/,@ugo.avila @kareninagf porque en la hora libre puedo hacer hasta 2 horas 😣 vayan conmigo !!! Jajaja la piscina está vaciiiaaaaa ❤️
ugo.avila,17848932097057763,https://www.instagram.com/p/7f_LYKqywr/,Porque no vas a la hora que vamos nosotros? @kareninagf se pone muy triste
