hashtags:,#selfie,#bestfriends,#bowl,#befis,#perdiendocomosiempre,#yamevoy,#losquiero,#amiguitosdelbosque,#boliche,#amigos,#medueleelorgullo
post_url,username,comment_id,comment_text
ugo.avila,17867247982038145,https://www.instagram.com/p/BOOIyfvDSnj/,"Hahahahaha, yo no estaba esa vez anterior @vickywolff"
vickywolff,17870649421058306,https://www.instagram.com/p/BOOIyfvDSnj/,"@kareninagf @ugo.avila pobres ilusos, lo que no saben es que yo me reinvindicaré! Recuerden que yo gané la vez anterior 🙄 lo olvidan?"
kareninagf,17861656984064924,https://www.instagram.com/p/BOOIyfvDSnj/,Revancha Revancha Peleeea Peleeea!!!!! Hahahaha TE RETO @ugo.avila
ugo.avila,17867869579032871,https://www.instagram.com/p/BOOIyfvDSnj/,"Creo que a alguien ya se le subió a la cabeza... @kareninagf , creo que como le di chance eso le pasó, ya te ganaré mi amor. Sorry"
kareninagf,17846559172136505,https://www.instagram.com/p/BOOIyfvDSnj/,Tu orgullo no puede doler más que el de @ugo.avila ... Quien en teoría era el Master of puppets hahah bromi
